{
  "$schema": "https://json-schema.org/draft/2020-12/schema",
  "$id": "https://stacks-project-zh.invalid/schema/source-adoption.schema.json",
  "title": "Immutable complete first-source adoption and generation history",
  "type": "object",
  "additionalProperties": false,
  "required": [
    "schema_version",
    "tool_version",
    "adoption_id",
    "origin_commit",
    "source_commit",
    "created_at",
    "input",
    "raw_attempts",
    "run",
    "outputs",
    "unit_ids",
    "chapter",
    "parent_tags",
    "run_id"
  ],
  "properties": {
    "schema_version": {
      "const": 1
    },
    "tool_version": {
      "enum": [
        "source-adoption-v1",
        "source-adoption-v2",
        "source-adoption-v3"
      ]
    },
    "adoption_id": {
      "type": "string",
      "pattern": "^[A-Za-z0-9][A-Za-z0-9._-]*$"
    },
    "origin_commit": {
      "type": "string",
      "pattern": "^[0-9a-f]{40}$"
    },
    "source_commit": {
      "type": "string",
      "pattern": "^[0-9a-f]{40}$"
    },
    "created_at": {
      "type": "string",
      "format": "date-time"
    },
    "input": {
      "type": "object",
      "additionalProperties": false,
      "required": [
        "path",
        "hash"
      ],
      "properties": {
        "path": {
          "type": "string",
          "minLength": 1
        },
        "hash": {
          "type": "string",
          "pattern": "^sha256:[0-9a-f]{64}$"
        }
      }
    },
    "raw_attempts": {
      "type": "array",
      "items": {
        "type": "object",
        "additionalProperties": false,
        "required": [
          "path",
          "hash",
          "unit_ids"
        ],
        "properties": {
          "path": {
            "type": "string",
            "minLength": 1
          },
          "hash": {
            "type": "string",
            "pattern": "^sha256:[0-9a-f]{64}$"
          },
          "unit_ids": {
            "type": "array",
            "items": {
              "type": "string",
              "minLength": 1
            }
          }
        }
      }
    },
    "run": {
      "type": "object",
      "additionalProperties": false,
      "required": [
        "path",
        "hash"
      ],
      "properties": {
        "path": {
          "type": "string",
          "minLength": 1
        },
        "hash": {
          "type": "string",
          "pattern": "^sha256:[0-9a-f]{64}$"
        }
      }
    },
    "outputs": {
      "type": "array",
      "items": {
        "type": "object",
        "additionalProperties": false,
        "required": [
          "units",
          "candidates"
        ],
        "properties": {
          "units": {
            "type": "object",
            "additionalProperties": false,
            "required": [
              "path",
              "hash"
            ],
            "properties": {
              "path": {
                "type": "string",
                "minLength": 1
              },
              "hash": {
                "type": "string",
                "pattern": "^sha256:[0-9a-f]{64}$"
              }
            }
          },
          "candidates": {
            "type": "object",
            "additionalProperties": false,
            "required": [
              "path",
              "hash"
            ],
            "properties": {
              "path": {
                "type": "string",
                "minLength": 1
              },
              "hash": {
                "type": "string",
                "pattern": "^sha256:[0-9a-f]{64}$"
              }
            }
          }
        }
      }
    },
    "unit_ids": {
      "type": "array",
      "uniqueItems": true,
      "items": {
        "type": "string",
        "minLength": 1
      }
    },
    "chapter": {
      "type": "string",
      "minLength": 1
    },
    "parent_tags": {
      "type": "array",
      "uniqueItems": true,
      "items": {
        "type": "string",
        "minLength": 1
      }
    },
    "run_id": {
      "type": "string",
      "pattern": "^[A-Za-z0-9._-]+$"
    }
  }
}
