{
  "adoption_id": "stacks-introduction-072i-072j-g001-20261021",
  "chapter": "stacks-introduction",
  "created_at": "2026-10-21T14:29:03.020829Z",
  "input": {
    "hash": "sha256:d80d3cc830ea34f2c657b8e78e7cd2f43cb18a69d3c2b278936d7aeca0b0be45",
    "path": "translation-data/source-adoption-inputs/stacks-introduction-072i-072j-g001-20261021.json"
  },
  "origin_commit": "a53e3edd47784658af30152aaf7ff3e5c6a3f3ac",
  "outputs": [
    {
      "candidates": {
        "hash": "sha256:769eafed61d9b95a52772a7909e0e1d5b5e06242fc1d8cc8200251f2e2b57c95",
        "path": "translation-data/candidates/openai-gpt-6.1-sol/stacks-introduction-072I.jsonl"
      },
      "units": {
        "hash": "sha256:3078af5122ce5d9994d18bd0cdae6dab3352957960ef4883e33af88c45c550e4",
        "path": "translation-data/units/stacks-introduction-072I.jsonl"
      }
    },
    {
      "candidates": {
        "hash": "sha256:0ed7d3d1d790eba1913b64e357cdbb7783ec93ccc7624e113f0973bb7f09c7d0",
        "path": "translation-data/candidates/openai-gpt-6.1-sol/stacks-introduction-072J.jsonl"
      },
      "units": {
        "hash": "sha256:c7152d544f23d10d4d14dce55783b3eb0408bd11b5ff12701a8a9c91c8bbb708",
        "path": "translation-data/units/stacks-introduction-072J.jsonl"
      }
    }
  ],
  "parent_tags": [
    "072I",
    "072J"
  ],
  "raw_attempts": [
    {
      "hash": "sha256:c60aa37571c84e9cb488c5529aec94bdac63940f1c55019ced53f1620046d0a7",
      "path": "docs/evidence/stacks-introduction-072i-072j-g001-20261021-raw.jsonl",
      "unit_ids": [
        "tag:072I:title",
        "tag:072I:prose-0001",
        "tag:072J:title",
        "tag:072J:prose-0001"
      ]
    }
  ],
  "run": {
    "hash": "sha256:2289fb4b19ddd660480a758fd91ac5513e15bff5ddc33c00c4d001411dfdf261",
    "path": "translation-data/runs/run-stacks-introduction-072i-072j-g001-20261021.json"
  },
  "run_id": "run-stacks-introduction-072i-072j-g001-20261021",
  "schema_version": 1,
  "source_commit": "a04446e57ec1fbc252a871afcec7752fb2807b14",
  "tool_version": "source-adoption-v1",
  "unit_ids": [
    "tag:072I:title",
    "tag:072I:prose-0001",
    "tag:072J:title",
    "tag:072J:prose-0001"
  ]
}
