{
  "adoption_id": "sites-complete-g014-20261023",
  "chapter": "sites",
  "created_at": "2026-10-24T00:34:23.828032Z",
  "input": {
    "hash": "sha256:05345209a919150804382e0618dce55962580fe096961cc880d5e6691628a21d",
    "path": "translation-data/source-adoption-inputs/sites-complete-g014-20261023.json"
  },
  "origin_commit": "fdc35145795557af18d3622e13b9a1602463706e",
  "outputs": [
    {
      "candidates": {
        "hash": "sha256:53dddb72376d523ff7544bca9f0fd33f495e1beda913f9450b2d43fe41d3a8c7",
        "path": "translation-data/candidates/openai-gpt-6.1-sol/sites-00XI-part01.jsonl"
      },
      "units": {
        "hash": "sha256:a30a52c69fb952c5610ed7dba3e2fe9200e1a3d641e9786b24ade4f6c1463f56",
        "path": "translation-data/units/sites-00XI-part01.jsonl"
      }
    },
    {
      "candidates": {
        "hash": "sha256:f9fcb7a6f31e242a091f8c5c6f565afca01c67d83af4f14e12b2fa6b984c3fd3",
        "path": "translation-data/candidates/openai-gpt-6.1-sol/sites-00XI-part02.jsonl"
      },
      "units": {
        "hash": "sha256:0258cad7bf01b1010ffc6ec9bc5b2fc909f6f619ca45eb13a165205d2527fea1",
        "path": "translation-data/units/sites-00XI-part02.jsonl"
      }
    },
    {
      "candidates": {
        "hash": "sha256:5c2aeb3d6aa2387e1f54d1bec7ce655ae6692da6ff1bd7f2e499c18d6b853287",
        "path": "translation-data/candidates/openai-gpt-6.1-sol/sites-00XN-part01.jsonl"
      },
      "units": {
        "hash": "sha256:0c47e1a178ee27c2e53a75ad44d4df5f8216e9f9c6fe9a876d3362a0337bc9a1",
        "path": "translation-data/units/sites-00XN-part01.jsonl"
      }
    }
  ],
  "parent_tags": [
    "00XI",
    "00XN"
  ],
  "raw_attempts": [
    {
      "hash": "sha256:122ebeee36112044c6b18882650b374ad9565a74797483d8cf4fbceada248a15",
      "path": "docs/evidence/sites-complete-g014-20261023-raw.jsonl",
      "unit_ids": [
        "tag:00XI:title",
        "tag:00XI:prose-0001",
        "tag:00XJ:statement",
        "tag:00XI:prose-0002",
        "tag:00XK:statement",
        "tag:00XK:proof",
        "tag:00XL:statement",
        "tag:00XL:proof",
        "tag:00XI:prose-0003",
        "tag:00XM:statement",
        "tag:00XM:proof",
        "tag:09W7:statement",
        "tag:00XN:title",
        "tag:00XN:prose-0001",
        "tag:00XO:statement",
        "tag:00XO:proof",
        "tag:03L5:statement",
        "tag:03L5:proof",
        "tag:00XP:statement"
      ]
    },
    {
      "hash": "sha256:c69e37a459548b6cbfc88052a1fc7dbc4b57c3274cbbf57998c5d388e8bcd628",
      "path": "docs/evidence/sites-complete-g014-20261023-retry-01-raw.jsonl",
      "unit_ids": [
        "tag:00XL:proof"
      ]
    }
  ],
  "run": {
    "hash": "sha256:743eeca2f001b73f828a185f6d7e18837cbc14d9e58f4756554d029406c11195",
    "path": "translation-data/runs/run-sites-complete-g014-20261023.json"
  },
  "run_id": "run-sites-complete-g014-20261023",
  "schema_version": 1,
  "source_commit": "a04446e57ec1fbc252a871afcec7752fb2807b14",
  "tool_version": "source-adoption-v1",
  "unit_ids": [
    "tag:00XI:title",
    "tag:00XI:prose-0001",
    "tag:00XJ:statement",
    "tag:00XI:prose-0002",
    "tag:00XK:statement",
    "tag:00XK:proof",
    "tag:00XL:statement",
    "tag:00XL:proof",
    "tag:00XI:prose-0003",
    "tag:00XM:statement",
    "tag:00XM:proof",
    "tag:09W7:statement",
    "tag:00XN:title",
    "tag:00XN:prose-0001",
    "tag:00XO:statement",
    "tag:00XO:proof",
    "tag:03L5:statement",
    "tag:03L5:proof",
    "tag:00XP:statement"
  ]
}
