{
  "adoption_id": "sites-complete-g005-20261023",
  "chapter": "sites",
  "created_at": "2026-10-23T16:38:09.813783Z",
  "input": {
    "hash": "sha256:3bf28b1575af01e4e6402e52c8697196f4dc897300f284420c5529cbff98ff15",
    "path": "translation-data/source-adoption-inputs/sites-complete-g005-20261023.json"
  },
  "origin_commit": "fdc35145795557af18d3622e13b9a1602463706e",
  "outputs": [
    {
      "candidates": {
        "hash": "sha256:9312ee78b9c1ebb76ae62bd6dcd97bd3632facce3152bdf08715a78ac9d1fe15",
        "path": "translation-data/candidates/openai-gpt-6.1-sol/sites-00VS-part02.jsonl"
      },
      "units": {
        "hash": "sha256:9030c544103675cb7bb770885cd24ecbf6f55afb661e245c55375f7be7d7a116",
        "path": "translation-data/units/sites-00VS-part02.jsonl"
      }
    },
    {
      "candidates": {
        "hash": "sha256:512a8245cd1771eea4f22ee6303161c8238ee20ba8e6afdc05963eb90b663504",
        "path": "translation-data/candidates/openai-gpt-6.1-sol/sites-00VZ-part01.jsonl"
      },
      "units": {
        "hash": "sha256:bcedf54833ae6951e6839c797ac301cdcf36bb28e4796881c438783fe0001841",
        "path": "translation-data/units/sites-00VZ-part01.jsonl"
      }
    },
    {
      "candidates": {
        "hash": "sha256:ab1149ca7e218e6d25b253559159a0eac41c4c586a535c96466cb3cb95196551",
        "path": "translation-data/candidates/openai-gpt-6.1-sol/sites-00VZ-part02.jsonl"
      },
      "units": {
        "hash": "sha256:f5e83c3381b139bc6c004891e7c7b938d3ac3ac10f3d0d4051bc622e8910fd39",
        "path": "translation-data/units/sites-00VZ-part02.jsonl"
      }
    }
  ],
  "parent_tags": [
    "00VS",
    "00VZ"
  ],
  "raw_attempts": [
    {
      "hash": "sha256:b72899f5d34a4939c236757866c8e59d86e8d2881cace2a32a823b8059da3e75",
      "path": "docs/evidence/sites-complete-g005-20261023-raw.jsonl",
      "unit_ids": [
        "tag:0G1K:statement",
        "tag:0G1K:proof",
        "tag:0G1L:statement",
        "tag:0G1L:proof",
        "tag:00VX:statement",
        "tag:00VX:proof",
        "tag:00VY:statement",
        "tag:00VY:proof",
        "tag:00VZ:title",
        "tag:00VZ:prose-0001",
        "tag:00W0:statement",
        "tag:00W0:proof"
      ]
    },
    {
      "hash": "sha256:f2df96a454d999afce2f635124d1e65abf852ec64ba9a46850e159a4848bfee1",
      "path": "docs/evidence/sites-complete-g005-20261023-retry-01-raw.jsonl",
      "unit_ids": [
        "tag:0G1L:proof",
        "tag:00VZ:title",
        "tag:00VZ:prose-0001"
      ]
    }
  ],
  "run": {
    "hash": "sha256:5bbf0f4fe8a4d9fc1695e1ca510dc6b717b099b53cdfe2d2b079603d9bbb2632",
    "path": "translation-data/runs/run-sites-complete-g005-20261023.json"
  },
  "run_id": "run-sites-complete-g005-20261023",
  "schema_version": 1,
  "source_commit": "a04446e57ec1fbc252a871afcec7752fb2807b14",
  "tool_version": "source-adoption-v1",
  "unit_ids": [
    "tag:0G1K:statement",
    "tag:0G1K:proof",
    "tag:0G1L:statement",
    "tag:0G1L:proof",
    "tag:00VX:statement",
    "tag:00VX:proof",
    "tag:00VY:statement",
    "tag:00VY:proof",
    "tag:00VZ:title",
    "tag:00VZ:prose-0001",
    "tag:00W0:statement",
    "tag:00W0:proof"
  ]
}
