{
  "adoption_id": "sites-complete-g025-r02-20261024",
  "chapter": "sites",
  "created_at": "2026-10-24T14:58:09.830059Z",
  "input": {
    "hash": "sha256:0a1e1bdea74b45538b75ec190f6c3731e6ba31b565a9794b63476ccefe6176e4",
    "path": "translation-data/source-adoption-inputs/sites-complete-g025-r02-20261024.json"
  },
  "origin_commit": "fdc35145795557af18d3622e13b9a1602463706e",
  "outputs": [
    {
      "candidates": {
        "hash": "sha256:d3b0563fcb576c7e326ad7d696a152d0ad4f9789093d61750423cb98c74c4b61",
        "path": "translation-data/candidates/openai-gpt-6.1-sol/sites-05UZ-part01.jsonl"
      },
      "units": {
        "hash": "sha256:7187ea28154c89bd0268d4c758b13538d8eb8834e95ef80b300829dc97400c21",
        "path": "translation-data/units/sites-05UZ-part01.jsonl"
      }
    },
    {
      "candidates": {
        "hash": "sha256:3f94ca934c3936148ad2f57776323c93b0727bafa21555c6506e6b87344c494a",
        "path": "translation-data/candidates/openai-gpt-6.1-sol/sites-05UZ-part02.jsonl"
      },
      "units": {
        "hash": "sha256:616377b4ddf209f3c8a83826d3628e19e6e56b8cd76c8ef718f7ab7aaed33b46",
        "path": "translation-data/units/sites-05UZ-part02.jsonl"
      }
    },
    {
      "candidates": {
        "hash": "sha256:2dd190f81d72ee39ceacc5bf119fb57f6818fedbbc71fc7856ce52d6f6768533",
        "path": "translation-data/candidates/openai-gpt-6.1-sol/sites-05UZ-part03.jsonl"
      },
      "units": {
        "hash": "sha256:886004fef0d668a793148369d2fa0814e85aecfa5ba6125ee79a0cca19d8ae46",
        "path": "translation-data/units/sites-05UZ-part03.jsonl"
      }
    }
  ],
  "parent_tags": [
    "05UZ"
  ],
  "raw_attempts": [
    {
      "hash": "sha256:5e55d3e29d42929fe62d3cccdc6642bdd48343c97575650309ce6c3357e6be5d",
      "path": "docs/evidence/sites-complete-g025-r02-20261024-raw.jsonl",
      "unit_ids": [
        "tag:05UZ:title",
        "tag:05UZ:prose-0001",
        "tag:0F4E:statement",
        "tag:0F4E:proof",
        "tag:00YB:statement",
        "tag:00YB:proof",
        "tag:00YC:statement",
        "tag:00YC:proof",
        "tag:00YD:statement",
        "tag:00YE:statement",
        "tag:04EJ:statement",
        "tag:00YF:statement",
        "tag:08RH:statement"
      ]
    },
    {
      "hash": "sha256:b0f199d88608d8eb000b72e6c861210804088c890c94f0810e9f5a77b16b18cf",
      "path": "docs/evidence/sites-complete-g025-r02-20261024-retry-01-raw.jsonl",
      "unit_ids": [
        "tag:04EJ:statement",
        "tag:00YF:statement"
      ]
    },
    {
      "hash": "sha256:6f3febff72ec77b85642dcc30974739b3c8c218093588b131a13085b19a7acbe",
      "path": "docs/evidence/sites-complete-g025-r02-20261024-retry-02-raw.jsonl",
      "unit_ids": [
        "tag:00YB:statement",
        "tag:00YD:statement",
        "tag:00YE:statement",
        "tag:04EJ:statement",
        "tag:00YF:statement",
        "tag:08RH:statement"
      ]
    }
  ],
  "run": {
    "hash": "sha256:cd6ca33dfc8e89c1c56bb1c0d2b3e757aa2752bd9df2bc535db6f3fd0b561da3",
    "path": "translation-data/runs/run-sites-complete-g025-r02-20261024.json"
  },
  "run_id": "run-sites-complete-g025-r02-20261024",
  "schema_version": 1,
  "source_commit": "a04446e57ec1fbc252a871afcec7752fb2807b14",
  "tool_version": "source-adoption-v1",
  "unit_ids": [
    "tag:05UZ:title",
    "tag:05UZ:prose-0001",
    "tag:0F4E:statement",
    "tag:0F4E:proof",
    "tag:00YB:statement",
    "tag:00YB:proof",
    "tag:00YC:statement",
    "tag:00YC:proof",
    "tag:00YD:statement",
    "tag:00YE:statement",
    "tag:04EJ:statement",
    "tag:00YF:statement",
    "tag:08RH:statement"
  ]
}
