{
  "adoption_id": "categories-completion-g011-resumed-20261020",
  "chapter": "categories",
  "created_at": "2026-10-20T06:54:35.146344Z",
  "input": {
    "hash": "sha256:0ef60980bf6c17a00e925a709f3cc895850206303694ef7b09644b602034c096",
    "path": "translation-data/source-adoption-inputs/categories-completion-g011-resumed-20261020.json"
  },
  "origin_commit": "e1ca00c228c1194186a065450c1b2c33cc4b8ae9",
  "outputs": [
    {
      "candidates": {
        "hash": "sha256:fcfe462c5aaa03826939c9cefb3586de240d4c93a4edbc6e1f79741d129dc737",
        "path": "translation-data/candidates/openai-gpt-6.1-sol/categories-remaining-0GWI.jsonl"
      },
      "units": {
        "hash": "sha256:98091453912a1cc5bdcc974224dd8ae03c024c017e142920f6d617006382e77d",
        "path": "translation-data/units/categories-remaining-0GWI.jsonl"
      }
    },
    {
      "candidates": {
        "hash": "sha256:1640084c091ebf85e375f52ca05a23db1dda38de36b291ab106d1626e31e1c9c",
        "path": "translation-data/candidates/openai-gpt-6.1-sol/categories-remaining-004B.jsonl"
      },
      "units": {
        "hash": "sha256:577926036f1b10da7608eced19e859b069887cb5b0b0d4d2cc7aa824970c1a88",
        "path": "translation-data/units/categories-remaining-004B.jsonl"
      }
    }
  ],
  "parent_tags": [
    "0GWH"
  ],
  "raw_attempts": [
    {
      "hash": "sha256:e9db9e5b63b480b326b8e57c0e8eaf5e6feb4b17f2a6b0443e08051f04f772cd",
      "path": "docs/evidence/categories-completion-g011-resumed-20261020-raw.jsonl",
      "unit_ids": [
        "tag:0GWI:statement",
        "tag:0GWI:proof",
        "tag:004B:statement",
        "tag:004B:proof"
      ]
    },
    {
      "hash": "sha256:425482b63709b6d805b86bfdd681e67f3ca2d67f351bfc4b67b3323f3152558e",
      "path": "docs/evidence/categories-completion-g011-resumed-20261020-retry1-raw.jsonl",
      "unit_ids": [
        "tag:0GWI:statement",
        "tag:004B:statement"
      ]
    }
  ],
  "run": {
    "hash": "sha256:a412dfd1438380e0c2003cee2390094e9fd9d42f7bba99de18aec1948d511248",
    "path": "translation-data/runs/run-categories-completion-g011-resumed-20261020.json"
  },
  "run_id": "run-categories-completion-g011-resumed-20261020",
  "schema_version": 1,
  "source_commit": "a04446e57ec1fbc252a871afcec7752fb2807b14",
  "tool_version": "source-adoption-v3",
  "unit_ids": [
    "tag:0GWI:statement",
    "tag:0GWI:proof",
    "tag:004B:statement",
    "tag:004B:proof"
  ]
}
